{
  "schema": 1,
  "generated_at": "2026-10-25T13:32:30Z",
  "source": {
    "name": "models.dev",
    "url": "https://models.dev/api.json",
    "license": "MIT"
  },
  "providers": {
    "claude": {
      "label": "Anthropic Claude",
      "source_id": "anthropic",
      "default_model": "claude-haiku-5-5",
      "free_tier": false,
      "models": {
        "claude-haiku-5-5": {
          "name": "Claude Haiku 5.5",
          "status": "active",
          "context": 1000000,
          "input": [
            "text",
            "image",
            "pdf"
          ],
          "tools": true,
          "reasoning": true,
          "origin": "models.dev",
          "family": "claude-haiku",
          "release_date": "2026-10-07",
          "output": 128000,
          "structured_output": true,
          "cost": {
            "in": 0.1,
            "out": 0.5,
            "cache_read": 0.01,
            "cache_write": 0.125
          },
          "label": "Claude Haiku 5.5",
          "recommended": true
        },
        "claude-sonnet-5-5": {
          "name": "Claude Sonnet 5.5",
          "status": "active",
          "context": 1000000,
          "input": [
            "text",
            "image",
            "pdf"
          ],
          "tools": true,
          "reasoning": true,
          "origin": "models.dev",
          "family": "claude-sonnet",
          "release_date": "2026-09-28",
          "output": 128000,
          "structured_output": true,
          "cost": {
            "in": 2,
            "out": 10,
            "cache_read": 0.1,
            "cache_write": 2.5
          },
          "label": "Claude Sonnet 5.5",
          "recommended": true
        },
        "claude-opus-5-5": {
          "name": "Claude Opus 5.5",
          "status": "active",
          "context": 1000000,
          "input": [
            "text",
            "image",
            "pdf"
          ],
          "tools": true,
          "reasoning": true,
          "origin": "models.dev",
          "family": "claude-opus",
          "release_date": "2026-09-22",
          "output": 128000,
          "structured_output": true,
          "cost": {
            "in": 4,
            "out": 20,
            "cache_read": 0.2,
            "cache_write": 5
          },
          "label": "Claude Opus 5.5",
          "recommended": true
        },
        "claude-fable-5-1": {
          "name": "Claude Fable 5.1",
          "status": "active",
          "context": 1000000,
          "input": [
            "text",
            "image",
            "pdf"
          ],
          "tools": true,
          "reasoning": true,
          "origin": "models.dev",
          "family": "claude-fable",
          "release_date": "2026-09-01",
          "output": 128000,
          "structured_output": true,
          "cost": {
            "in": 10,
            "out": 50,
            "cache_read": 0.25,
            "cache_write": 12.5
          },
          "label": "Claude Fable 5.1",
          "recommended": true
        },
        "claude-opus-5": {
          "name": "Claude Opus 5",
          "status": "active",
          "context": 1000000,
          "input": [
            "text",
            "image",
            "pdf"
          ],
          "tools": true,
          "reasoning": true,
          "origin": "models.dev",
          "family": "claude-opus",
          "release_date": "2026-07-24",
          "output": 128000,
          "structured_output": true,
          "cost": {
            "in": 5,
            "out": 25,
            "cache_read": 0.5,
            "cache_write": 6.25
          },
          "label": "Claude Opus 5",
          "recommended": true
        },
        "claude-sonnet-5": {
          "name": "Claude Sonnet 5",
          "status": "active",
          "context": 1000000,
          "input": [
            "text",
            "image",
            "pdf"
          ],
          "tools": true,
          "reasoning": true,
          "origin": "models.dev",
          "family": "claude-sonnet",
          "release_date": "2026-06-29",
          "output": 128000,
          "structured_output": true,
          "cost": {
            "in": 2,
            "out": 10,
            "cache_read": 0.2,
            "cache_write": 2.5
          },
          "label": "Claude Sonnet 5",
          "recommended": true
        },
        "claude-fable-5": {
          "name": "Claude Fable 5",
          "status": "active",
          "context": 1000000,
          "input": [
            "text",
            "image",
            "pdf"
          ],
          "tools": true,
          "reasoning": true,
          "origin": "models.dev",
          "family": "claude-fable",
          "release_date": "2026-06-07",
          "output": 128000,
          "structured_output": true,
          "cost": {
            "in": 10,
            "out": 50,
            "cache_read": 1,
            "cache_write": 12.5
          }
        },
        "claude-haiku-4-5": {
          "name": "Claude Haiku 4.5 (latest)",
          "status": "active",
          "context": 200000,
          "input": [
            "text",
            "image",
            "pdf"
          ],
          "tools": true,
          "reasoning": true,
          "origin": "models.dev",
          "family": "claude-haiku",
          "release_date": "2025-10-15",
          "output": 64000,
          "structured_output": true,
          "cost": {
            "in": 1,
            "out": 5,
            "cache_read": 0.1,
            "cache_write": 1.25
          }
        }
      }
    },
    "openai": {
      "label": "OpenAI",
      "source_id": "openai",
      "default_model": "gpt-6-luna",
      "free_tier": false,
      "models": {
        "gpt-6.1-sol": {
          "name": "GPT-6.1 Sol",
          "status": "active",
          "context": 1050000,
          "input": [
            "text",
            "image",
            "pdf"
          ],
          "tools": true,
          "reasoning": true,
          "origin": "models.dev",
          "family": "gpt-sol",
          "release_date": "2026-09-29",
          "output": 128000,
          "structured_output": true,
          "cost": {
            "in": 2,
            "out": 10,
            "cache_read": 0.1,
            "cache_write": 2.5
          },
          "label": "GPT-6.1 Sol (2/10 $)",
          "recommended": true
        },
        "gpt-6-sol": {
          "name": "GPT-6 Sol",
          "status": "active",
          "context": 1050000,
          "input": [
            "text",
            "image",
            "pdf"
          ],
          "tools": true,
          "reasoning": true,
          "origin": "models.dev",
          "family": "gpt-sol",
          "release_date": "2026-09-22",
          "output": 128000,
          "structured_output": true,
          "cost": {
            "in": 2,
            "out": 10,
            "cache_read": 0.2,
            "cache_write": 2.5
          }
        },
        "gpt-6-luna": {
          "name": "GPT-6 Luna",
          "status": "active",
          "context": 1050000,
          "input": [
            "text",
            "image",
            "pdf"
          ],
          "tools": true,
          "reasoning": true,
          "origin": "models.dev",
          "family": "gpt-luna",
          "release_date": "2026-09-22",
          "output": 128000,
          "structured_output": true,
          "cost": {
            "in": 0.1,
            "out": 0.5,
            "cache_read": 0.01,
            "cache_write": 0.125
          },
          "label": "GPT-6 Luna (le moins cher, 0,10/0,50 $)",
          "recommended": true
        },
        "gpt-6-astra": {
          "name": "GPT-6 Astra",
          "status": "active",
          "context": 1050000,
          "input": [
            "text",
            "image",
            "pdf"
          ],
          "tools": true,
          "reasoning": true,
          "origin": "models.dev",
          "family": "gpt-astra",
          "release_date": "2026-09-04",
          "output": 128000,
          "structured_output": true,
          "cost": {
            "in": 10,
            "out": 50,
            "cache_read": 1,
            "cache_write": 12.5
          },
          "label": "GPT-6 Astra (flagship, 10/50 $)",
          "recommended": true
        },
        "gpt-daybreak-red-latest": {
          "name": "Daybreak Red",
          "status": "active",
          "context": 400000,
          "input": [
            "text",
            "image"
          ],
          "tools": true,
          "reasoning": true,
          "origin": "models.dev",
          "family": "gpt",
          "release_date": "2026-08-07",
          "output": 128000,
          "structured_output": true,
          "cost": {
            "in": 12.5,
            "out": 75,
            "cache_read": 1.25,
            "cache_write": 15.625
          }
        },
        "gpt-5.6-terra": {
          "name": "GPT-5.6 Terra",
          "status": "active",
          "context": 1050000,
          "input": [
            "text",
            "image",
            "pdf"
          ],
          "tools": true,
          "reasoning": true,
          "origin": "models.dev",
          "family": "gpt-terra",
          "release_date": "2026-07-09",
          "output": 128000,
          "structured_output": true,
          "cost": {
            "in": 2,
            "out": 12,
            "cache_read": 0.2,
            "cache_write": 2.5
          }
        },
        "gpt-5.6-luna": {
          "name": "GPT-5.6 Luna",
          "status": "active",
          "context": 1050000,
          "input": [
            "text",
            "image",
            "pdf"
          ],
          "tools": true,
          "reasoning": true,
          "origin": "models.dev",
          "family": "gpt-luna",
          "release_date": "2026-07-09",
          "output": 128000,
          "structured_output": true,
          "cost": {
            "in": 0.2,
            "out": 1.2,